98,東京都,平成23年_第２回,1,23,6,17,定例,平成23年_第２回定例会(第７号),知事（石原慎太郎君）,知事,知事,石原慎太郎,原発事故では、命を差し出す覚悟で自衛隊員、警察官、消防隊員、企業の現場作業員が奮闘してきました。,null,null,null
99,東京都,平成23年_第２回,1,23,6,17,定例,平成23年_第２回定例会(第７号),知事（石原慎太郎君）,知事,知事,石原慎太郎,都庁舎にも義援物資を持った都民が長蛇の列をなし、都に寄せられた義援金は約六億円にも上っております。,null,null,null
100,東京都,平成23年_第２回,1,23,6,17,定例,平成23年_第２回定例会(第７号),知事（石原慎太郎君）,知事,知事,石原慎太郎,これらは、豊穣な四季に恵まれながらも、厳しい自然や天変地異と隣り合わせにある我が国の風土、歴史が培った日本人の美質にほかなりません。,null,null,null
101,東京都,平成23年_第２回,1,23,6,17,定例,平成23年_第２回定例会(第７号),知事（石原慎太郎君）,知事,知事,石原慎太郎,政治は、義援金がいまだ十分に行き渡らないような、国民の誠意が生かされない状況をそのままにしていてはなりません。,null,null,null
102,東京都,平成23年_第２回,1,23,6,17,定例,平成23年_第２回定例会(第７号),知事（石原慎太郎君）,知事,知事,石原慎太郎,呼び覚まされた忍耐、自己犠牲、同胞への連帯の心を、我が国の真の復活に向けた力にかえていかなければならないのであります。,null,null,null
103,東京都,平成23年_第２回,1,23,6,17,定例,平成23年_第２回定例会(第７号),知事（石原慎太郎君）,知事,知事,石原慎太郎,政治は、ただ右往左往し、場当たりを繰り返すのではなく、大震災からの復興を一日も早く実現するとともに、従前から直面する課題にも挑んで、戦後の安易な他力本願や目先の利益追求を反省し、社会を修復へと導かなければなりません。,null,null,null
104,東京都,平成23年_第２回,1,23,6,17,定例,平成23年_第２回定例会(第７号),知事（石原慎太郎君）,知事,知事,石原慎太郎,とりわけ、首都を預かる都政が何をなすかが我が国の将来を決します。,null,null,null
105,東京都,平成23年_第２回,1,23,6,17,定例,平成23年_第２回定例会(第７号),知事（石原慎太郎君）,知事,知事,石原慎太郎,国家にも匹敵する力を持った東京から、大震災を乗り越え、将来への確固たる展望を示し、信頼を回復するメッセージも世界に発信しなければなりません。,null,null,null
106,東京都,平成23年_第２回,1,23,6,17,定例,平成23年_第２回定例会(第７号),知事（石原慎太郎君）,知事,知事,石原慎太郎,ゆえにも、政治、行政、都民、国民のあらゆる力を結集し、東京だからできる総力戦を展開いたします。,null,null,null
107,東京都,平成23年_第２回,1,23,6,17,定例,平成23年_第２回定例会(第７号),知事（石原慎太郎君）,知事,知事,石原慎太郎,日本を再び立ち上がらせるために、大震災にあって果たすべき東京の役割に全力を尽くし、国家の行き詰まりを打破する道筋も示してまいります。,null,null,null
108,東京都,平成23年_第２回,1,23,6,17,定例,平成23年_第２回定例会(第７号),知事（石原慎太郎君）,知事,知事,石原慎太郎,まずもって、眼前の危機に迅速に対処しなければなりません。,null,null,null
109,東京都,平成23年_第２回,1,23,6,17,定例,平成23年_第２回定例会(第７号),知事（石原慎太郎君）,知事,知事,石原慎太郎,東京は、福島の電力を初め、被災地の農林水産物や工業製品などに負ってきました。,null,null,null
110,東京都,平成23年_第２回,1,23,6,17,定例,平成23年_第２回定例会(第７号),知事（石原慎太郎君）,知事,知事,石原慎太郎,東京が、刻苦しながら再び立ち上がらんとする方々を全面的に支援するのは当然であります。,null,null,null
111,東京都,平成23年_第２回,1,23,6,17,定例,平成23年_第２回定例会(第７号),知事（石原慎太郎君）,知事,知事,石原慎太郎,これまでも福島、仙台、盛岡に現地事務所を設置し、ニーズを的確にとらえ協力してきました。,null,null,null
112,東京都,平成23年_第２回,1,23,6,17,定例,平成23年_第２回定例会(第７号),知事（石原慎太郎君）,知事,知事,石原慎太郎,今後も、被災地、被災者のため、実務にたけた技術職員やこころのケアチームなど、必要な人材をできる限り派遣いたします。,null,null,null
113,東京都,平成23年_第２回,1,23,6,17,定例,平成23年_第２回定例会(第７号),知事（石原慎太郎君）,知事,知事,石原慎太郎,被災地の復旧に立ちはだかる瓦れきについては、区市町村や民間と共同して都内に受け入れ、処理に協力してまいります。,null,null,null
114,東京都,平成23年_第２回,1,23,6,17,定例,平成23年_第２回定例会(第７号),知事（石原慎太郎君）,知事,知事,石原慎太郎,経済の立て直しも急がれておりまして、風評被害にさらされる農林水産物について、安全性を消費者に正確に伝え販売を後押しするなど、巨大な消費地である東京を復興のために提供いたします。,null,null,null
115,東京都,平成23年_第２回,1,23,6,17,定例,平成23年_第２回定例会(第７号),知事（石原慎太郎君）,知事,知事,石原慎太郎,また、売り上げの減少が深刻な被災地の中小企業の受注回復につなげるため、都内中小企業等との商談会を現地で開催いたします。,null,null,null
116,東京都,平成23年_第２回,1,23,6,17,定例,平成23年_第２回定例会(第７号),知事（石原慎太郎君）,知事,知事,石原慎太郎,都内に退避された方々も支えてまいります。,null,null,null
117,東京都,平成23年_第２回,1,23,6,17,定例,平成23年_第２回定例会(第７号),知事（石原慎太郎君）,知事,知事,石原慎太郎,現在、約五千人の方々を都営住宅等で受け入れておりまして、福祉相談や孤立化を防ぐ個別訪問、就業支援や子どもの就学支援など、生活全般をサポートいたしております。,null,null,null
118,東京都,平成23年_第２回,1,23,6,17,定例,平成23年_第２回定例会(第７号),知事（石原慎太郎君）,知事,知事,石原慎太郎,大震災の影響が都内にも及んでおりまして、都民、事業所を確かな手だてで守らなければなりません。,null,null,null
119,東京都,平成23年_第２回,1,23,6,17,定例,平成23年_第２回定例会(第７号),知事（石原慎太郎君）,知事,知事,石原慎太郎,震災により直接、間接に被害を受けて厳しい状況にある中小企業に対して、制度融資の新たなメニューを追加して、資金繰りに万全を期してまいります。,null,null,null
120,東京都,平成23年_第２回,1,23,6,17,定例,平成23年_第２回定例会(第７号),知事（石原慎太郎君）,知事,知事,石原慎太郎,経営が急速に悪化した中小企業に専門家を派遣し、立ち直りを支援いたします。,null,null,null
121,東京都,平成23年_第２回,1,23,6,17,定例,平成23年_第２回定例会(第７号),知事（石原慎太郎君）,知事,知事,石原慎太郎,雇用面において、東京しごとセンターに離職を余儀なくされた方々のための専門窓口を設置して、就職を後押ししてまいります。,null,null,null
122,東京都,平成23年_第２回,1,23,6,17,定例,平成23年_第２回定例会(第７号),知事（石原慎太郎君）,知事,知事,石原慎太郎,放射能への不安も広がっておりまして、測定体制を強化し、結果をホームページや街頭ビジョンで公表いたします。,null,null,null
123,東京都,平成23年_第２回,1,23,6,17,定例,平成23年_第２回定例会(第７号),知事（石原慎太郎君）,知事,知事,石原慎太郎,都民の不安を払い、冷静に行動する手がかりとなるよう、情報をわかりやすく迅速に提供してまいります。,null,null,null
124,東京都,平成23年_第２回,1,23,6,17,定例,平成23年_第２回定例会(第７号),知事（石原慎太郎君）,知事,知事,石原慎太郎,電力不足の中での猛暑にも備えて、自治会、民生委員等の地域の力で高齢者を見守り、熱中症対策緊急病床も確保してまいります。,null,null,null
125,東京都,平成23年_第２回,1,23,6,17,定例,平成23年_第２回定例会(第７号),知事（石原慎太郎君）,知事,知事,石原慎太郎,大震災では、東京は被災地に比べはるかに小さな揺れであったにもかかわらず、都市機能は麻痺いたしました。,null,null,null
126,東京都,平成23年_第２回,1,23,6,17,定例,平成23年_第２回定例会(第７号),知事（石原慎太郎君）,知事,知事,石原慎太郎,帰宅困難者の問題が現実となり、相次ぐ余震や電力不足に伴う計画停電などで不安心理が高じ、被災地に最優先で送られるべきガソリンや水、食料品などの買い占めも起こりました。,null,null,null
127,東京都,平成23年_第２回,1,23,6,17,定例,平成23年_第２回定例会(第７号),知事（石原慎太郎君）,知事,知事,石原慎太郎,ふだんは当たり前と思っている都市の機能がいかにもろいかが明らかになったことから、災害対策を根底から見直してまいります。,null,null,null
128,東京都,平成23年_第２回,1,23,6,17,定例,平成23年_第２回定例会(第７号),知事（石原慎太郎君）,知事,知事,石原慎太郎,帰宅困難者が駅から締め出されるような事態が再び起こらぬよう、事業者などおのおのの役割分担、責任を明確化し、燃料や生活必需品の備蓄のあり方も抜本的に見直します。,null,null,null
129,東京都,平成23年_第２回,1,23,6,17,定例,平成23年_第２回定例会(第７号),知事（石原慎太郎君）,知事,知事,石原慎太郎,直下型地震への備えを固め直し、東京にも大きな影響が懸念される東海、東南海、南海三連動地震への対策も新たに加えた東京都防災対応指針を十一月を目途に策定いたします。,null,null,null
130,東京都,平成23年_第２回,1,23,6,17,定例,平成23年_第２回定例会(第７号),知事（石原慎太郎君）,知事,知事,石原慎太郎,専門家の指摘によれば、東京では体に感じないものも含めて、地震が実に十分間に一回は起きておるそうです。,null,null,null
131,東京都,平成23年_第２回,1,23,6,17,定例,平成23年_第２回定例会(第７号),知事（石原慎太郎君）,知事,知事,石原慎太郎,世界最大の火山脈の上にある地震大国の首都を守るためには、まち自体を災害に強くしなければなりません。,null,null,null
132,東京都,平成23年_第２回,1,23,6,17,定例,平成23年_第２回定例会(第７号),知事（石原慎太郎君）,知事,知事,石原慎太郎,これまでも阪神・淡路大震災の教訓などを取り入れ、道路や橋梁、ライフラインなどの耐震性を高め、液状化対策にも取り組んできました。,null,null,null
133,東京都,平成23年_第２回,1,23,6,17,定例,平成23年_第２回定例会(第７号),知事（石原慎太郎君）,知事,知事,石原慎太郎,これを強化しながら、津波、高潮に備えて、区部東部に広がるゼロメートル地帯や臨海部を守るインフラについて総点検いたします。,null,null,null
134,東京都,平成23年_第２回,1,23,6,17,定例,平成23年_第２回定例会(第７号),知事（石原慎太郎君）,知事,知事,石原慎太郎,もとより、災害に強いまちづくりは、ひとり行政だけではできません。,null,null,null
135,東京都,平成23年_第２回,1,23,6,17,定例,平成23年_第２回定例会(第７号),知事（石原慎太郎君）,知事,知事,石原慎太郎,人間は、死が不可避であるにもかかわらず、自分自身の死を信じないのと同様に、地震が起きても自分だけは大丈夫だと考えがちであります。,null,null,null
136,東京都,平成23年_第２回,1,23,6,17,定例,平成23年_第２回定例会(第７号),知事（石原慎太郎君）,知事,知事,石原慎太郎,これを改め、地震を我がこととしてとらえなければ、肝心の建物の耐震化は進まず、危険な木造住宅密集地域は残り続けます。,null,null,null
137,東京都,平成23年_第２回,1,23,6,17,定例,平成23年_第２回定例会(第７号),知事（石原慎太郎君）,知事,知事,石原慎太郎,さきの定例会で決まった緊急輸送道路沿道の建物に耐震診断を義務づける条例に基づき、対象となる路線を速やかに指定いたします。,null,null,null
138,東京都,平成23年_第２回,1,23,6,17,定例,平成23年_第２回定例会(第７号),知事（石原慎太郎君）,知事,知事,石原慎太郎,また、建物の耐震性がわかるマークの表示制度を創設して、条例を効果的に運用してまいります。,null,null,null
139,東京都,平成23年_第２回,1,23,6,17,定例,平成23年_第２回定例会(第７号),知事（石原慎太郎君）,知事,知事,石原慎太郎,木造住宅密集地域には専門家を派遣して、建物倒壊の恐怖や火災が津波のように広がる危険性を示し、住民の意識を変えてまいります。,null,null,null
140,東京都,平成23年_第２回,1,23,6,17,定例,平成23年_第２回定例会(第７号),知事（石原慎太郎君）,知事,知事,石原慎太郎,まちづくり施策や税制、建てかえ時の生活支援策なども総動員した新たな手法も編み出し、壊れず燃えないまちへの歯車を大きく回していきたいと思っております。,null,null,null
141,東京都,平成23年_第２回,1,23,6,17,定例,平成23年_第２回定例会(第７号),知事（石原慎太郎君）,知事,知事,石原慎太郎,一連の取り組みによって、いかなる災害に直面しても都民の生活が確実に守られ、一刻たりとも日本の頭脳、心臓がとまらないように、高度な防災力を備えた都市を造形してまいります。,null,null,null
142,東京都,平成23年_第２回,1,23,6,17,定例,平成23年_第２回定例会(第７号),知事（石原慎太郎君）,知事,知事,石原慎太郎,なお、国は、国家における首都の役割を全く考慮せず、ただみずからの場当たりな財政運営を糊塗するために、本来地方税である法人事業税の税収を東京から一方的に奪っております。,null,null,null
143,東京都,平成23年_第２回,1,23,6,17,定例,平成23年_第２回定例会(第７号),知事（石原慎太郎君）,知事,知事,石原慎太郎,東京がつぶれ、日本が崩壊するようなことがあってはならず、東京の金を東京を守るために東京が使おうという我々の意思を国が阻む道理は全くありません。,null,null,null
144,東京都,平成23年_第２回,1,23,6,17,定例,平成23年_第２回定例会(第７号),知事（石原慎太郎君）,知事,知事,石原慎太郎,法人事業税の暫定措置の即時撤廃を、改めて強く要求してまいります。,null,null,null
145,東京都,平成23年_第２回,1,23,6,17,定例,平成23年_第２回定例会(第７号),知事（石原慎太郎君）,知事,知事,石原慎太郎,我が国が真に立ち直るには、単にこうむった被害の復元にとどまらず、再起を通じて生活様式や価値観を転換し、次なる日本への道筋をつける必要があります。,null,null,null
146,東京都,平成23年_第２回,1,23,6,17,定例,平成23年_第２回定例会(第７号),知事（石原慎太郎君）,知事,知事,石原慎太郎,こうした観点に立って、東京はいかなる都市を目指し、社会や仕組みを率先して構築すべきか申し上げたいと思います。,null,null,null
147,東京都,平成23年_第２回,1,23,6,17,定例,平成23年_第２回定例会(第７号),知事（石原慎太郎君）,知事,知事,石原慎太郎,原発事故に伴い、電力不足に直面しております。,null,null,null
148,東京都,平成23年_第２回,1,23,6,17,定例,平成23年_第２回定例会(第７号),知事（石原慎太郎君）,知事,知事,石原慎太郎,国は、節電の目標数値は定めても、あとは企業、国民にげたを預けており、何への遠慮か産業活動や国民生活を考えたみずからの権限行使に極めて極めて消極的であります。,null,null,null
149,東京都,平成23年_第２回,1,23,6,17,定例,平成23年_第２回定例会(第７号),知事（石原慎太郎君）,知事,知事,石原慎太郎,先般のサミットでは、実現への具体策も示さずに、一千万世帯に太陽光発電パネルを設置するとやみくもに打ち上げました。,null,null,null
150,東京都,平成23年_第２回,1,23,6,17,定例,平成23年_第２回定例会(第７号),知事（石原慎太郎君）,知事,知事,石原慎太郎,これを見ても、国は、国家存立の生命線である経済やエネルギーについて、定見を持ち合わせておるとは到底思えません。,null,null,null
151,東京都,平成23年_第２回,1,23,6,17,定例,平成23年_第２回定例会(第７号),知事（石原慎太郎君）,知事,知事,石原慎太郎,今必要なのは、電力不足の長期化や災害の発生はもとより、地球の温暖化も見据えた上で、環境と経済とが高度に両立した社会をつくり上げることであります。,null,null,null
152,東京都,平成23年_第２回,1,23,6,17,定例,平成23年_第２回定例会(第７号),知事（石原慎太郎君）,知事,知事,石原慎太郎,節電を機に生活や意識を変え、ＣＯ２を削減しつつ、必要なエネルギーは低炭素で高効率なものへと多様化、分散化して確保していく戦略的な思考が求められております。,null,null,null
153,東京都,平成23年_第２回,1,23,6,17,定例,平成23年_第２回定例会(第７号),知事（石原慎太郎君）,知事,知事,石原慎太郎,それゆえ、節電は夏を乗り切るだけではなく、こうこうと輝くネオンやまちじゅうに林立する自動販売機に表象される過剰なエネルギー消費に痛痒を感じない社会や、過度の便利さになれた生活を見直し、二十一世紀にふさわしい低炭素型社会に転換する、またとない機会にしなければなりません。,null,null,null
154,東京都,平成23年_第２回,1,23,6,17,定例,平成23年_第２回定例会(第７号),知事（石原慎太郎君）,知事,知事,石原慎太郎,まず、都庁舎が率先して政府の目標を大幅に上回る二五％の節電を実行しております。,null,null,null
155,東京都,平成23年_第２回,1,23,6,17,定例,平成23年_第２回定例会(第７号),知事（石原慎太郎君）,知事,知事,石原慎太郎,そして、地球温暖化対策で培ってきた省エネ、節電のノウハウをフル活用し、企業の具体的で実効性のある取り組みを後押ししてまいります。,null,null,null
156,東京都,平成23年_第２回,1,23,6,17,定例,平成23年_第２回定例会(第７号),知事（石原慎太郎君）,知事,知事,石原慎太郎,公立小中学校では節電教育を実施し、家族ぐるみで家庭の暮らしを見直すことを促してまいります。,null,null,null
157,東京都,平成23年_第２回,1,23,6,17,定例,平成23年_第２回定例会(第７号),知事（石原慎太郎君）,知事,知事,石原慎太郎,一方、電力不足によって、遠隔地の大規模発電所からの送電に頼り切ってきたもろさが明らかになったことから、東京という日本のダイナモが麻痺してとまらぬように、打つべき手を果断に打たなければなりません。,null,null,null
158,東京都,平成23年_第２回,1,23,6,17,定例,平成23年_第２回定例会(第７号),知事（石原慎太郎君）,知事,知事,石原慎太郎,電力供給への不安により産業が停滞し空洞化することを防ぐため、首都圏の電力自給能力を高めてまいります。,null,null,null
159,東京都,平成23年_第２回,1,23,6,17,定例,平成23年_第２回定例会(第７号),知事（石原慎太郎君）,知事,知事,石原慎太郎,これに極めて有効な天然ガス発電所の新規建設に向け、民間とも連携し、行動を開始いたします。,null,null,null
160,東京都,平成23年_第２回,1,23,6,17,定例,平成23年_第２回定例会(第７号),知事（石原慎太郎君）,知事,知事,石原慎太郎,また、人命を預かる病院などの必要不可欠な電力は、いかなる事態にあっても確保しなければならず、自家発電設備の導入を支援いたします。,null,null,null
161,東京都,平成23年_第２回,1,23,6,17,定例,平成23年_第２回定例会(第７号),知事（石原慎太郎君）,知事,知事,石原慎太郎,さらに、家庭への太陽光発電パネルの普及を後押しするほか、大規模開発では地域エネルギー供給システムの導入を促進するなど、東京の隅々に発電装置を分散して配備し、危機にあっても東京が動き続けることを可能にしてまいります。,null,null,null
162,東京都,平成23年_第２回,1,23,6,17,定例,平成23年_第２回定例会(第７号),知事（石原慎太郎君）,知事,知事,石原慎太郎,エネルギー政策を都市政策の柱に据え、東京発の環境エネルギー戦略を展開し、国に提起してまいります。,null,null,null
163,東京都,平成23年_第２回,1,23,6,17,定例,平成23年_第２回定例会(第７号),知事（石原慎太郎君）,知事,知事,石原慎太郎,大震災からの復興を考えるに際して、関東大震災の復興を担った後藤新平に脚光が当たっております。,null,null,null
164,東京都,平成23年_第２回,1,23,6,17,定例,平成23年_第２回定例会(第７号),知事（石原慎太郎君）,知事,知事,石原慎太郎,後藤新平は、モータリゼーションの隆盛を見越したかのように、環状道路などの重要な都市インフラを構想し、東京を本格的な近代都市へと導きました。,null,null,null
165,東京都,平成23年_第２回,1,23,6,17,定例,平成23年_第２回定例会(第７号),知事（石原慎太郎君）,知事,知事,石原慎太郎,それから九十年を経て、平成二十五年度に中央環状線がようやく全線開通し、彼の卓見が一つの形として実を結びます。,null,null,null
166,東京都,平成23年_第２回,1,23,6,17,定例,平成23年_第２回定例会(第７号),知事（石原慎太郎君）,知事,知事,石原慎太郎,我々は、先見性あふれた大きな構想力に大いに学ぶべきであります。,null,null,null
167,東京都,平成23年_第２回,1,23,6,17,定例,平成23年_第２回定例会(第７号),知事（石原慎太郎君）,知事,知事,石原慎太郎,同時に、文明工学的視点を欠いた政治と行政が続いたがために、実際の道路整備はおくれ、交通渋滞や大気汚染という多大な損失を生んだ現実も忘れてはなりません。,null,null,null
168,東京都,平成23年_第２回,1,23,6,17,定例,平成23年_第２回定例会(第７号),知事（石原慎太郎君）,知事,知事,石原慎太郎,都市インフラの整備は、未来につながる財産を築く極めて重要な営みであります。,null,null,null
169,東京都,平成23年_第２回,1,23,6,17,定例,平成23年_第２回定例会(第７号),知事（石原慎太郎君）,知事,知事,石原慎太郎,これまでも「十年後の東京」計画に基づいて、投資効果の高い事業に力を注いできました。,null,null,null
170,東京都,平成23年_第２回,1,23,6,17,定例,平成23年_第２回定例会(第７号),知事（石原慎太郎君）,知事,知事,石原慎太郎,今後とも、東京と日本のさらなる発展のために、大きな流れにかなった都市インフラをたゆみなく整備いたします。,null,null,null
171,東京都,平成23年_第２回,1,23,6,17,定例,平成23年_第２回定例会(第７号),知事（石原慎太郎君）,知事,知事,石原慎太郎,ただいま述べた中央環状線の開通を初め、今年度の東京港臨海道路の完成、いよいよ工事着手となる外環道の整備などにより、二十世紀の負の遺産である交通渋滞を大幅に解消いたします。,null,null,null
