172,東京都,平成23年_第２回,1,23,6,17,定例,平成23年_第２回定例会(第７号),知事（石原慎太郎君）,知事,知事,石原慎太郎,圏央道の整備はもとより、来年度の府中清瀬線、新滝山街道の開通などで多摩の発展にも拍車をかけてまいります。,null,null,null
173,東京都,平成23年_第２回,1,23,6,17,定例,平成23年_第２回定例会(第７号),知事（石原慎太郎君）,知事,知事,石原慎太郎,さらに、新しい大動脈をつくって、文明発展の原動力である人、物、情報の交流を革新的に高めるために、品川を、世界と日本を結ぶ羽田空港と我が国の三大都市圏を約一時間で結ぶリニア中央新幹線との結節点にしてまいります。,null,null,null
174,東京都,平成23年_第２回,1,23,6,17,定例,平成23年_第２回定例会(第７号),知事（石原慎太郎君）,知事,知事,石原慎太郎,着々と整備が進む都市インフラを跳躍台に、東京は金の卵を産む鶏として日本経済を牽引し続けなければなりません。,null,null,null
175,東京都,平成23年_第２回,1,23,6,17,定例,平成23年_第２回定例会(第７号),知事（石原慎太郎君）,知事,知事,石原慎太郎,成長の旗を振り、雇用を生んで若者の就職を確保し、福祉を充実させる富も生む循環を導かなければ、大震災からの復興はおくれます。,null,null,null
176,東京都,平成23年_第２回,1,23,6,17,定例,平成23年_第２回定例会(第７号),知事（石原慎太郎君）,知事,知事,石原慎太郎,少子高齢化に伴う財政負担の増大も到底乗り越えることはできずに、日本は沈むしかありません。,null,null,null
177,東京都,平成23年_第２回,1,23,6,17,定例,平成23年_第２回定例会(第７号),知事（石原慎太郎君）,知事,知事,石原慎太郎,東京の高度な集中、集積を堅持し、世界じゅうから人、物、金融、情報を吸い寄せる磁力を維持すべく、首都としての防災力、危機管理能力を向上させて国内外の信頼を高めるとともに、放射線測定値も広く発信して国際的な風評被害を払拭してまいります。,null,null,null
178,東京都,平成23年_第２回,1,23,6,17,定例,平成23年_第２回定例会(第７号),知事（石原慎太郎君）,知事,知事,石原慎太郎,また、外国企業のアジア本社や研究機関を誘致するために、国の規制や競争上のハンディキャップを乗り越える総合特区制度を活用いたします。,null,null,null
179,東京都,平成23年_第２回,1,23,6,17,定例,平成23年_第２回定例会(第７号),知事（石原慎太郎君）,知事,知事,石原慎太郎,これを起爆剤として、外国の頭脳と日本の頭脳が刺激し合って新たな価値を生む舞台を整え、集積の底力を引き出し、アジア諸国にはまねのできない研究開発や新技術、新サービスの創出を促してまいります。,null,null,null
180,東京都,平成23年_第２回,1,23,6,17,定例,平成23年_第２回定例会(第７号),知事（石原慎太郎君）,知事,知事,石原慎太郎,多摩シリコンバレーの形成も加速すべく、産業技術の新たな教育機関も整備いたします。,null,null,null
181,東京都,平成23年_第２回,1,23,6,17,定例,平成23年_第２回定例会(第７号),知事（石原慎太郎君）,知事,知事,石原慎太郎,正確無比な公共交通システム、多彩な食文化、世界自然遺産登録目前の小笠原を初めとする豊かな自然といった東京ならではの魅力もさらに高めるなど、都市政策や産業政策、交通政策等を重層的に展開し、アジアのヘッドクオーターへと東京を進化させてまいります。,null,null,null
182,東京都,平成23年_第２回,1,23,6,17,定例,平成23年_第２回定例会(第７号),知事（石原慎太郎君）,知事,知事,石原慎太郎,大震災にあって、同じ被災者同士が支え合い、秩序正しく行動する姿は世界を瞠目させました。,null,null,null
183,東京都,平成23年_第２回,1,23,6,17,定例,平成23年_第２回定例会(第７号),知事（石原慎太郎君）,知事,知事,石原慎太郎,人間は他者とのかかわりなくして生きてはいけず、血縁で結ばれた家族から始まる連帯が、会社や地域などを通じて広がり、堆積重層してエネルギーを生むこの世の中の公理を改めて悟らされました。,null,null,null
184,東京都,平成23年_第２回,1,23,6,17,定例,平成23年_第２回定例会(第７号),知事（石原慎太郎君）,知事,知事,石原慎太郎,社会の安全と安心には、行政による子育て施策や高齢者福祉といった公助の充実だけではなくて、地域の力などの共助も不可欠であります。,null,null,null
185,東京都,平成23年_第２回,1,23,6,17,定例,平成23年_第２回定例会(第７号),知事（石原慎太郎君）,知事,知事,石原慎太郎,東京は全国から人が集まり、核家族化が進み、価値観も多様化して、しがらみもなければきずなも希薄であります。,null,null,null
186,東京都,平成23年_第２回,1,23,6,17,定例,平成23年_第２回定例会(第７号),知事（石原慎太郎君）,知事,知事,石原慎太郎,そればかりか、親殺し、子殺しといったおぞましい事件も後を絶ちません。,null,null,null
187,東京都,平成23年_第２回,1,23,6,17,定例,平成23年_第２回定例会(第７号),知事（石原慎太郎君）,知事,知事,石原慎太郎,ならばこそ、大震災を機に人間のきずなの価値を再認識し、大都市にふさわしい連帯の形をつくり上げる必要があります。,null,null,null
188,東京都,平成23年_第２回,1,23,6,17,定例,平成23年_第２回定例会(第７号),知事（石原慎太郎君）,知事,知事,石原慎太郎,これは、過度の権利を主張し、責任は軽視する戦後のあしき風潮を変えることにもなるに違いありません。,null,null,null
189,東京都,平成23年_第２回,1,23,6,17,定例,平成23年_第２回定例会(第７号),知事（石原慎太郎君）,知事,知事,石原慎太郎,まずは、住宅街で近所のつながりを結び直します。,null,null,null
190,東京都,平成23年_第２回,1,23,6,17,定例,平成23年_第２回定例会(第７号),知事（石原慎太郎君）,知事,知事,石原慎太郎,また、ネットの中でつながる若者を地域での現実の人の輪へと橋渡しをいたします。,null,null,null
191,東京都,平成23年_第２回,1,23,6,17,定例,平成23年_第２回定例会(第７号),知事（石原慎太郎君）,知事,知事,石原慎太郎,区市町村とも連帯し、防災隣組ともいうべき新たな共助のきずなを張りめぐらすことにより、常日ごろから周りを気遣い、声をかけ合い、孤立とは無縁な、災害時に一人でも多くの人が救われる東京へと転換してまいります。,null,null,null
192,東京都,平成23年_第２回,1,23,6,17,定例,平成23年_第２回定例会(第７号),知事（石原慎太郎君）,知事,知事,石原慎太郎,いわゆる失われた二十年に生まれ育った今の子どもたちは、停滞、衰微する日本しか知りません。,null,null,null
193,東京都,平成23年_第２回,1,23,6,17,定例,平成23年_第２回定例会(第７号),知事（石原慎太郎君）,知事,知事,石原慎太郎,そんな子どもたちに大震災があったとはいえ、さらに大きな重荷を背負った国家を残すことは許されません。,null,null,null
194,東京都,平成23年_第２回,1,23,6,17,定例,平成23年_第２回定例会(第７号),知事（石原慎太郎君）,知事,知事,石原慎太郎,我々には、環境と調和した社会や良質な社会資本、強い経済、連帯に裏打ちされた安全と安心を次の世代に引き継がせる責務があります。,null,null,null
195,東京都,平成23年_第２回,1,23,6,17,定例,平成23年_第２回定例会(第７号),知事（石原慎太郎君）,知事,知事,石原慎太郎,そして、複雑さと厳しさを増す国際社会を生き抜く力を与えなければなりません。,null,null,null
196,東京都,平成23年_第２回,1,23,6,17,定例,平成23年_第２回定例会(第７号),知事（石原慎太郎君）,知事,知事,石原慎太郎,四方を激しい海に囲まれ、外に出て行くことが極めて困難であった日本の国土は、受動的で自己主張が苦手な日本人の性情を形づくってきました。,null,null,null
197,東京都,平成23年_第２回,1,23,6,17,定例,平成23年_第２回定例会(第７号),知事（石原慎太郎君）,知事,知事,石原慎太郎,こうした民族的ＤＮＡに加え、昨今の若者は過保護に漬かって抵抗力を欠き、ひ弱な内向き志向も見られます。,null,null,null
198,東京都,平成23年_第２回,1,23,6,17,定例,平成23年_第２回定例会(第７号),知事（石原慎太郎君）,知事,知事,石原慎太郎,しかし、既に手にした繁栄もむなしい夢に終わりかねない今、この閉塞を打ち破り、国家の希望となり得るのは若者しかありません。,null,null,null
199,東京都,平成23年_第２回,1,23,6,17,定例,平成23年_第２回定例会(第７号),知事（石原慎太郎君）,知事,知事,石原慎太郎,世界に飛び出し、摩擦、相克の中で明確に意思表示もしながら、独自の才能を開花させていくような若者こそが求められております。,null,null,null
200,東京都,平成23年_第２回,1,23,6,17,定例,平成23年_第２回定例会(第７号),知事（石原慎太郎君）,知事,知事,石原慎太郎,かわいい子には旅をさせよといいますが、世界を舞台に活躍する力強い若者を育成すべく、海外武者修行や留学を直接応援する新たな仕組みを構築したいと思います。,null,null,null
201,東京都,平成23年_第２回,1,23,6,17,定例,平成23年_第２回定例会(第７号),知事（石原慎太郎君）,知事,知事,石原慎太郎,あらゆる摩擦、相克に耐えるためにも、脳幹を鍛えていかなければなりません。,null,null,null
202,東京都,平成23年_第２回,1,23,6,17,定例,平成23年_第２回定例会(第７号),知事（石原慎太郎君）,知事,知事,石原慎太郎,その効果的な方法であるスポーツを通じて、若者に成長する喜びを実感させ、強靱な肉体や健全な精神を養ってまいります。,null,null,null
203,東京都,平成23年_第２回,1,23,6,17,定例,平成23年_第２回定例会(第７号),知事（石原慎太郎君）,知事,知事,石原慎太郎,国際化の時代に必須な論理的思考力や、他者と十二分に意思を交わす言語の技術といった言葉の力も身につけさせます。,null,null,null
204,東京都,平成23年_第２回,1,23,6,17,定例,平成23年_第２回定例会(第７号),知事（石原慎太郎君）,知事,知事,石原慎太郎,戦後、我が国は、正当な歴史を教えることもせずに、官僚に表象されるような先行事例を学び、追いかけることにたけた人材を効率よく生み出すための教育が惰性のように続き、子どもから個性や想像力の芽を摘んできました。,null,null,null
205,東京都,平成23年_第２回,1,23,6,17,定例,平成23年_第２回定例会(第７号),知事（石原慎太郎君）,知事,知事,石原慎太郎,このままでは、子どもに海図、チャートもなしに二十一世紀の海へ乗り出せということになりかねません。,null,null,null
206,東京都,平成23年_第２回,1,23,6,17,定例,平成23年_第２回定例会(第７号),知事（石原慎太郎君）,知事,知事,石原慎太郎,知力、体力、人間力を備え、自信と誇りを持って世界と渡り合える人材を育てるために、従来の制度や常識、慣行にとらわれない新しいシステムが求められております。,null,null,null
207,東京都,平成23年_第２回,1,23,6,17,定例,平成23年_第２回定例会(第７号),知事（石原慎太郎君）,知事,知事,石原慎太郎,そこで、破壊的な教育改革を議論し発信してまいります。,null,null,null
208,東京都,平成23年_第２回,1,23,6,17,定例,平成23年_第２回定例会(第７号),知事（石原慎太郎君）,知事,知事,石原慎太郎,高い見識とたぐいまれな人生経験を持ち、国際感覚も豊かな方々から成る教育再生・東京円卓会議を設置いたします。,null,null,null
209,東京都,平成23年_第２回,1,23,6,17,定例,平成23年_第２回定例会(第７号),知事（石原慎太郎君）,知事,知事,石原慎太郎,あわせて、ただいま申し上げた産業技術の新たな教育機関で次代のものづくり人材を育成するなど、これからの我が国を担う人材を東京から輩出してまいりたいと思います。,null,null,null
210,東京都,平成23年_第２回,1,23,6,17,定例,平成23年_第２回定例会(第７号),知事（石原慎太郎君）,知事,知事,石原慎太郎,これまで述べた施策を強力に推進するために、すぐに着手すべきことを東京緊急対策二〇一一にまとめ、とりわけ早期の予算措置が必要な施策は補正予算に計上し、本定例会に提案しております。,null,null,null
211,東京都,平成23年_第２回,1,23,6,17,定例,平成23年_第２回定例会(第７号),知事（石原慎太郎君）,知事,知事,石原慎太郎,年末には「十年後の東京」計画を改定して「二〇二〇年の東京」を策定し、東京を一段と高い次元で成熟させる新たな政策を構築してまいります。,null,null,null
212,東京都,平成23年_第２回,1,23,6,17,定例,平成23年_第２回定例会(第７号),知事（石原慎太郎君）,知事,知事,石原慎太郎,次に、オリンピック・パラリンピック招致について申し上げます。,null,null,null
213,東京都,平成23年_第２回,1,23,6,17,定例,平成23年_第２回定例会(第７号),知事（石原慎太郎君）,知事,知事,石原慎太郎,一九六四年十月十日、世界じゅうの青空を持ってきたかのような快晴のもと、神宮の森に聖火がともりました。,null,null,null
214,東京都,平成23年_第２回,1,23,6,17,定例,平成23年_第２回定例会(第７号),知事（石原慎太郎君）,知事,知事,石原慎太郎,戦後の焼け野原から立ち上がり、国際社会に復興した姿を示した瞬間でありました。,null,null,null
215,東京都,平成23年_第２回,1,23,6,17,定例,平成23年_第２回定例会(第７号),知事（石原慎太郎君）,知事,知事,石原慎太郎,世界史的にもかつてない今回の大震災からの復興は、戦災からの復興にも匹敵する苦難の道のりでありましょう。,null,null,null
216,東京都,平成23年_第２回,1,23,6,17,定例,平成23年_第２回定例会(第７号),知事（石原慎太郎君）,知事,知事,石原慎太郎,しかし、必ずや立ち直り、九年後の日本の姿を披瀝するならば、世界じゅうから寄せられた友情や励ましへの何よりの返礼となるに違いありません。,null,null,null
217,東京都,平成23年_第２回,1,23,6,17,定例,平成23年_第２回定例会(第７号),知事（石原慎太郎君）,知事,知事,石原慎太郎,次代を担う若者に夢と希望を贈るためにも、日本開催を目指すたいまつを消さずにともし続けることは、我が国の将来にとって大きな意義があると思います。,null,null,null
218,東京都,平成23年_第２回,1,23,6,17,定例,平成23年_第２回定例会(第７号),知事（石原慎太郎君）,知事,知事,石原慎太郎,招致成功には、国やスポーツ界、経済界など国家の総力が結集され、機運が盛り上がることが不可欠であります。,null,null,null
219,東京都,平成23年_第２回,1,23,6,17,定例,平成23年_第２回定例会(第７号),知事（石原慎太郎君）,知事,知事,石原慎太郎,都民、国民の皆様にもぜひ、被災地を初め広く日本全体とスクラムを組んで、東京にオリンピック・パラリンピックを再び招致することを考えていただきたいと思います。,null,null,null
220,東京都,平成23年_第２回,1,23,6,17,定例,平成23年_第２回定例会(第７号),知事（石原慎太郎君）,知事,知事,石原慎太郎,招致に向けて、日本が一つになることを強く期待しております。,null,null,null
221,東京都,平成23年_第２回,1,23,6,17,定例,平成23年_第２回定例会(第７号),知事（石原慎太郎君）,知事,知事,石原慎太郎,さきの選挙では皆様のご支援を賜り、四たび都政のかじ取りを担うことになりました。,null,null,null
222,東京都,平成23年_第２回,1,23,6,17,定例,平成23年_第２回定例会(第７号),知事（石原慎太郎君）,知事,知事,石原慎太郎,内憂外患に呻吟する日本にとって、この四年間は正念場でありましょう。,null,null,null
223,東京都,平成23年_第２回,1,23,6,17,定例,平成23年_第２回定例会(第７号),知事（石原慎太郎君）,知事,知事,石原慎太郎,かつて福沢諭吉が、立国は私なり、公にあらず、この強い言葉で示した国家を動かす個々人の強い意思が、未曾有の危機にある今ほど必要なときはありません。,null,null,null
224,東京都,平成23年_第２回,1,23,6,17,定例,平成23年_第２回定例会(第７号),知事（石原慎太郎君）,知事,知事,石原慎太郎,政治は大きな目標を掲げ、現実を変える具体の手だてを通じて、個人の強い意思を連帯させ、大きな潮流にしていかなければならないのであります。,null,null,null
225,東京都,平成23年_第２回,1,23,6,17,定例,平成23年_第２回定例会(第７号),知事（石原慎太郎君）,知事,知事,石原慎太郎,それができる現場を持つ東京からこそ、この国の再生を先導しなければなりません。,null,null,null
226,東京都,平成23年_第２回,1,23,6,17,定例,平成23年_第２回定例会(第７号),知事（石原慎太郎君）,知事,知事,石原慎太郎,そのためにも被災地と肩を組み、首都圏と連合し、全国の自治体とも手を携えます。,null,null,null
227,東京都,平成23年_第２回,1,23,6,17,定例,平成23年_第２回定例会(第７号),知事（石原慎太郎君）,知事,知事,石原慎太郎,国には権限と財源の移譲や規制の改革を迫りますが、国の動きを待つだけでなく、必要とあらば民間とも手を携え、海外からの資金も活用してまいります。,null,null,null
228,東京都,平成23年_第２回,1,23,6,17,定例,平成23年_第２回定例会(第７号),知事（石原慎太郎君）,知事,知事,石原慎太郎,都議会の皆様とはともに首都を預かる政治家として議論を重ね、後の子孫が我々を顧みて、この四年間から日本は再び立ち上がったと認めてくれるような決断をし、施策も生み出したいと思います。,null,null,null
229,東京都,平成23年_第２回,1,23,6,17,定例,平成23年_第２回定例会(第７号),知事（石原慎太郎君）,知事,知事,石原慎太郎,身命を賭して都政運営に当たる決意であります。,null,null,null
230,東京都,平成23年_第２回,1,23,6,17,定例,平成23年_第２回定例会(第７号),知事（石原慎太郎君）,知事,知事,石原慎太郎,一層のご理解、ご協力をお願いいたします。,null,null,null
231,東京都,平成23年_第２回,1,23,6,17,定例,平成23年_第２回定例会(第７号),知事（石原慎太郎君）,知事,知事,石原慎太郎,なお、本定例会には、これまで申し上げたものを含め、予算案八件、条例案六件など、合わせて二十四件の議案を提案しております。,null,null,null
232,東京都,平成23年_第２回,1,23,6,17,定例,平成23年_第２回定例会(第７号),知事（石原慎太郎君）,知事,知事,石原慎太郎,よろしくご審議をお願いいたします。,null,null,null
233,東京都,平成23年_第２回,1,23,6,17,定例,平成23年_第２回定例会(第７号),知事（石原慎太郎君）,知事,知事,石原慎太郎,以上をもちまして所信表明を終わります。,null,null,null
234,東京都,平成23年_第２回,1,23,6,17,定例,平成23年_第２回定例会(第７号),知事（石原慎太郎君）,知事,知事,石原慎太郎,ありがとうございました。,null,null,null
235,東京都,平成23年_第２回,1,23,6,17,定例,平成23年_第２回定例会(第７号),知事（石原慎太郎君）,知事,知事,石原慎太郎,（拍手）,null,null,null
236,東京都,平成23年_第２回,1,23,6,17,定例,平成23年_第２回定例会(第７号),議長（和田宗春君）,議長,議長,和田宗春,知事の発言は終わりました。,null,null,null
237,東京都,平成23年_第２回,1,23,6,17,定例,平成23年_第２回定例会(第７号),議長（和田宗春君）,議長,議長,和田宗春,━━━━━━━━━━,null,null,null
238,東京都,平成23年_第２回,1,23,6,17,定例,平成23年_第２回定例会(第７号),七十四番（伊藤まさき君）,1300010000012,七十四番,伊藤まさき,この際、議事進行の動議を提出いたします。,null,null,null
239,東京都,平成23年_第２回,1,23,6,17,定例,平成23年_第２回定例会(第７号),七十四番（伊藤まさき君）,1300010000012,七十四番,伊藤まさき,本日の会議はこれをもって散会し、明十八日から二十二日まで五日間、議案調査のため休会されることを望みます。,null,null,null
240,東京都,平成23年_第２回,1,23,6,17,定例,平成23年_第２回定例会(第７号),議長（和田宗春君）,議長,議長,和田宗春,お諮りいたします。,null,null,null
241,東京都,平成23年_第２回,1,23,6,17,定例,平成23年_第２回定例会(第７号),議長（和田宗春君）,議長,議長,和田宗春,ただいまの動議のとおり決定することにご異議ありませんか。,null,null,null
242,東京都,平成23年_第２回,1,23,6,17,定例,平成23年_第２回定例会(第７号),議長（和田宗春君）,議長,議長,和田宗春,〔「異議なし」と呼ぶ者あり〕,null,null,null
243,東京都,平成23年_第２回,1,23,6,17,定例,平成23年_第２回定例会(第７号),議長（和田宗春君）,議長,議長,和田宗春,ご異議なしと認めます。,null,null,null
244,東京都,平成23年_第２回,1,23,6,17,定例,平成23年_第２回定例会(第７号),議長（和田宗春君）,議長,議長,和田宗春,よって、本日の会議はこれをもって散会し、明十八日から二十二日まで五日間、議案調査のため休会することに決定いたしました。,null,null,null
245,東京都,平成23年_第２回,1,23,6,17,定例,平成23年_第２回定例会(第７号),議長（和田宗春君）,議長,議長,和田宗春,なお、次回の会議は、六月二十三日午後一時に開きます。,null,null,null
246,東京都,平成23年_第２回,1,23,6,17,定例,平成23年_第２回定例会(第７号),議長（和田宗春君）,議長,議長,和田宗春,本日はこれをもって散会いたします。,null,null,null
247,東京都,平成23年_第２回,1,23,6,17,定例,平成23年_第２回定例会(第７号),議長（和田宗春君）,議長,議長,和田宗春,午後一時三十七分散会,null,null,null
