1,東京都,平成23年_第２回,1,23,6,17,定例,平成23年_第２回定例会(第７号),,,,,,null,null,null
2,東京都,平成23年_第２回,1,23,6,17,定例,平成23年_第２回定例会(第７号),議長（和田宗春君）,議長,議長,和田宗春,ただいまから平成二十三年第二回東京都議会定例会を開会いたします。,null,null,null
3,東京都,平成23年_第２回,1,23,6,17,定例,平成23年_第２回定例会(第７号),議長（和田宗春君）,議長,議長,和田宗春,━━━━━━━━━━,null,null,null
4,東京都,平成23年_第２回,1,23,6,17,定例,平成23年_第２回定例会(第７号),議長（和田宗春君）,議長,議長,和田宗春,この際、開議に先立ちまして、このたびの東日本大震災により亡くなられた方々のご冥福を祈るため、黙祷をささげたいと存じます。,null,null,null
5,東京都,平成23年_第２回,1,23,6,17,定例,平成23年_第２回定例会(第７号),議会局長（白石弥生子君）,その他,議会局長,白石弥生子,全員ご起立願います。,null,null,null
6,東京都,平成23年_第２回,1,23,6,17,定例,平成23年_第２回定例会(第７号),議会局長（白石弥生子君）,その他,議会局長,白石弥生子,〔全員起立〕,null,null,null
7,東京都,平成23年_第２回,1,23,6,17,定例,平成23年_第２回定例会(第７号),議会局長（白石弥生子君）,その他,議会局長,白石弥生子,黙祷をお願いいたします。,null,null,null
8,東京都,平成23年_第２回,1,23,6,17,定例,平成23年_第２回定例会(第７号),議会局長（白石弥生子君）,その他,議会局長,白石弥生子,〔黙　　祷〕,null,null,null
9,東京都,平成23年_第２回,1,23,6,17,定例,平成23年_第２回定例会(第７号),議会局長（白石弥生子君）,その他,議会局長,白石弥生子,黙祷を終わります。,null,null,null
10,東京都,平成23年_第２回,1,23,6,17,定例,平成23年_第２回定例会(第７号),議会局長（白石弥生子君）,その他,議会局長,白石弥生子,ご着席願います。,null,null,null
11,東京都,平成23年_第２回,1,23,6,17,定例,平成23年_第２回定例会(第７号),議会局長（白石弥生子君）,その他,議会局長,白石弥生子,━━━━━━━━━━,null,null,null
12,東京都,平成23年_第２回,1,23,6,17,定例,平成23年_第２回定例会(第７号),議長（和田宗春君）,議長,議長,和田宗春,これより本日の会議を開きます。,null,null,null
13,東京都,平成23年_第２回,1,23,6,17,定例,平成23年_第２回定例会(第７号),議長（和田宗春君）,議長,議長,和田宗春,━━━━━━━━━━,null,null,null
14,東京都,平成23年_第２回,1,23,6,17,定例,平成23年_第２回定例会(第７号),議長（和田宗春君）,議長,議長,和田宗春,まず、議席の変更を行います。,null,null,null
15,東京都,平成23年_第２回,1,23,6,17,定例,平成23年_第２回定例会(第７号),議長（和田宗春君）,議長,議長,和田宗春,議席変更の申し出がありますので、会議規則第二条第三項の規定により、お手元配布の議席変更表のとおり、議席の一部を変更いたします。,null,null,null
16,東京都,平成23年_第２回,1,23,6,17,定例,平成23年_第２回定例会(第７号),議長（和田宗春君）,議長,議長,和田宗春,（別冊参照）,null,null,null
17,東京都,平成23年_第２回,1,23,6,17,定例,平成23年_第２回定例会(第７号),議長（和田宗春君）,議長,議長,和田宗春,━━━━━━━━━━,null,null,null
18,東京都,平成23年_第２回,1,23,6,17,定例,平成23年_第２回定例会(第７号),議長（和田宗春君）,議長,議長,和田宗春,次に、去る四月十日執行されました東京都議会議員の補欠選挙において当選されました小宮あんりさんの議席を、会議規則第二条第二項の規定により、三番に指定いたします。,null,null,null
19,東京都,平成23年_第２回,1,23,6,17,定例,平成23年_第２回定例会(第７号),議長（和田宗春君）,議長,議長,和田宗春,━━━━━━━━━━,null,null,null
20,東京都,平成23年_第２回,1,23,6,17,定例,平成23年_第２回定例会(第７号),議長（和田宗春君）,議長,議長,和田宗春,次に、会議録署名議員の指名を行います。,null,null,null
21,東京都,平成23年_第２回,1,23,6,17,定例,平成23年_第２回定例会(第７号),議長（和田宗春君）,議長,議長,和田宗春,会議録署名議員は、会議規則第百二十四条の規定により、議長において、,null,null,null
22,東京都,平成23年_第２回,1,23,6,17,定例,平成23年_第２回定例会(第７号),議長（和田宗春君）,議長,議長,和田宗春,十一番　小山くにひこ君　及び,null,null,null
23,東京都,平成23年_第２回,1,23,6,17,定例,平成23年_第２回定例会(第７号),議長（和田宗春君）,議長,議長,和田宗春,七十番　服部ゆくお君,null,null,null
24,東京都,平成23年_第２回,1,23,6,17,定例,平成23年_第２回定例会(第７号),議長（和田宗春君）,議長,議長,和田宗春,を指名いたします。,null,null,null
25,東京都,平成23年_第２回,1,23,6,17,定例,平成23年_第２回定例会(第７号),議長（和田宗春君）,議長,議長,和田宗春,━━━━━━━━━━,null,null,null
26,東京都,平成23年_第２回,1,23,6,17,定例,平成23年_第２回定例会(第７号),議長（和田宗春君）,議長,議長,和田宗春,次に、議事部長をして諸般の報告をいたさせます。,null,null,null
27,東京都,平成23年_第２回,1,23,6,17,定例,平成23年_第２回定例会(第７号),議事部長（鈴木省五君）,その他,議事部長,鈴木省五,平成二十三年六月十日付東京都告示第九百六十二号をもって、知事より、本定例会を招集したとの通知がありました。,null,null,null
28,東京都,平成23年_第２回,1,23,6,17,定例,平成23年_第２回定例会(第７号),議事部長（鈴木省五君）,その他,議事部長,鈴木省五,また、同日付で、本定例会に提出するため、議案二十二件の送付がありました。,null,null,null
29,東京都,平成23年_第２回,1,23,6,17,定例,平成23年_第２回定例会(第７号),議事部長（鈴木省五君）,その他,議事部長,鈴木省五,次に、地方自治法第百七十九条第一項の規定に基づき専決処分した東京都教育委員会の事務処理の特例に関する条例の一部を改正する条例外一件の報告及び承認について依頼がありました。,null,null,null
30,東京都,平成23年_第２回,1,23,6,17,定例,平成23年_第２回定例会(第７号),議事部長（鈴木省五君）,その他,議事部長,鈴木省五,次に、平成二十三年第一回定例会の会議において同意を得た収用委員会委員及び収用委員会予備委員の任命について、発令したとの通知がありました。,null,null,null
31,東京都,平成23年_第２回,1,23,6,17,定例,平成23年_第２回定例会(第７号),議事部長（鈴木省五君）,その他,議事部長,鈴木省五,次に、平成二十二年度東京都一般会計予算外三件の明許繰越について、平成二十二年度東京都一般会計予算外五件の事故繰越について及び平成二十二年度東京都病院会計予算外八件の繰り越しについて、それぞれ報告がありました。,null,null,null
32,東京都,平成23年_第２回,1,23,6,17,定例,平成23年_第２回定例会(第７号),議事部長（鈴木省五君）,その他,議事部長,鈴木省五,次に、地方自治法第百八十条第一項の規定による議会の指定議決に基づき専決処分した訴えの提起、損害賠償額の決定及び和解に関する報告がありました。,null,null,null
33,東京都,平成23年_第２回,1,23,6,17,定例,平成23年_第２回定例会(第７号),議事部長（鈴木省五君）,その他,議事部長,鈴木省五,次に、監査委員より、例月出納検査の結果について報告がありました。,null,null,null
34,東京都,平成23年_第２回,1,23,6,17,定例,平成23年_第２回定例会(第７号),議事部長（鈴木省五君）,その他,議事部長,鈴木省五,また、監査結果に基づき知事等が講じた措置に関する報告がありました。,null,null,null
35,東京都,平成23年_第２回,1,23,6,17,定例,平成23年_第２回定例会(第７号),議事部長（鈴木省五君）,その他,議事部長,鈴木省五,次に、包括外部監査の結果に基づき知事が講じた措置の通知内容について、提出がありました。,null,null,null
36,東京都,平成23年_第２回,1,23,6,17,定例,平成23年_第２回定例会(第７号),議事部長（鈴木省五君）,その他,議事部長,鈴木省五,（別冊参照）,null,null,null
37,東京都,平成23年_第２回,1,23,6,17,定例,平成23年_第２回定例会(第７号),議事部長（鈴木省五君）,その他,議事部長,鈴木省五,━━━━━━━━━━,null,null,null
38,東京都,平成23年_第２回,1,23,6,17,定例,平成23年_第２回定例会(第７号),議長（和田宗春君）,議長,議長,和田宗春,この際、報告いたします。,null,null,null
39,東京都,平成23年_第２回,1,23,6,17,定例,平成23年_第２回定例会(第７号),議長（和田宗春君）,議長,議長,和田宗春,このたびの東日本大震災により被災された方々に対し、衷心よりお見舞いを申し上げます。,null,null,null
40,東京都,平成23年_第２回,1,23,6,17,定例,平成23年_第２回定例会(第７号),議長（和田宗春君）,議長,議長,和田宗春,本議会は、岩手県、宮城県及び福島県の県議会議長並びに知事に対し、見舞状を添えて、全議員の拠出による見舞金を贈呈いたしました。,null,null,null
41,東京都,平成23年_第２回,1,23,6,17,定例,平成23年_第２回定例会(第７号),議長（和田宗春君）,議長,議長,和田宗春,━━━━━━━━━━,null,null,null
42,東京都,平成23年_第２回,1,23,6,17,定例,平成23年_第２回定例会(第７号),議長（和田宗春君）,議長,議長,和田宗春,次に、文書質問に対する答弁書について申し上げます。,null,null,null
43,東京都,平成23年_第２回,1,23,6,17,定例,平成23年_第２回定例会(第７号),議長（和田宗春君）,議長,議長,和田宗春,第一回定例会に提出されました文書質問に対する答弁書は、質問趣意書とともに送付いたしておきました。,null,null,null
44,東京都,平成23年_第２回,1,23,6,17,定例,平成23年_第２回定例会(第７号),議長（和田宗春君）,議長,議長,和田宗春,ご了承願います。,null,null,null
45,東京都,平成23年_第２回,1,23,6,17,定例,平成23年_第２回定例会(第７号),議長（和田宗春君）,議長,議長,和田宗春,〔文書質問趣意書及び答弁書は本号末尾（八ページ）に掲載〕,null,null,null
46,東京都,平成23年_第２回,1,23,6,17,定例,平成23年_第２回定例会(第７号),議長（和田宗春君）,議長,議長,和田宗春,━━━━━━━━━━,null,null,null
47,東京都,平成23年_第２回,1,23,6,17,定例,平成23年_第２回定例会(第７号),議長（和田宗春君）,議長,議長,和田宗春,次に、閉会中の議員の退職について申し上げます。,null,null,null
48,東京都,平成23年_第２回,1,23,6,17,定例,平成23年_第２回定例会(第７号),議長（和田宗春君）,議長,議長,和田宗春,去る四月十七日、世田谷区選出花輪ともふみ君は、公職選挙法第九十条の規定により、退職となりました。,null,null,null
49,東京都,平成23年_第２回,1,23,6,17,定例,平成23年_第２回定例会(第７号),議長（和田宗春君）,議長,議長,和田宗春,━━━━━━━━━━,null,null,null
50,東京都,平成23年_第２回,1,23,6,17,定例,平成23年_第２回定例会(第７号),議長（和田宗春君）,議長,議長,和田宗春,次に、新たに当選されました小宮あんりさんをご紹介いたします。,null,null,null
51,東京都,平成23年_第２回,1,23,6,17,定例,平成23年_第２回定例会(第７号),議長（和田宗春君）,議長,議長,和田宗春,三番小宮あんりさん。,null,null,null
52,東京都,平成23年_第２回,1,23,6,17,定例,平成23年_第２回定例会(第７号),議長（和田宗春君）,議長,議長,和田宗春,〔三番小宮あんり君登壇〕,null,null,null
53,東京都,平成23年_第２回,1,23,6,17,定例,平成23年_第２回定例会(第７号),三番（小宮あんり君）,1300010000066,三番,小宮あんり,先般、杉並選挙区において行われました補欠選挙で選出をいただきました自由民主党の小宮あんりと申します。,null,null,null
54,東京都,平成23年_第２回,1,23,6,17,定例,平成23年_第２回定例会(第７号),三番（小宮あんり君）,1300010000066,三番,小宮あんり,どうぞよろしくお願いします。,null,null,null
55,東京都,平成23年_第２回,1,23,6,17,定例,平成23年_第２回定例会(第７号),三番（小宮あんり君）,1300010000066,三番,小宮あんり,（拍手）,null,null,null
56,東京都,平成23年_第２回,1,23,6,17,定例,平成23年_第２回定例会(第７号),議長（和田宗春君）,議長,議長,和田宗春,以上をもって紹介は終わりました。,null,null,null
57,東京都,平成23年_第２回,1,23,6,17,定例,平成23年_第２回定例会(第７号),議長（和田宗春君）,議長,議長,和田宗春,━━━━━━━━━━,null,null,null
58,東京都,平成23年_第２回,1,23,6,17,定例,平成23年_第２回定例会(第７号),議長（和田宗春君）,議長,議長,和田宗春,次に、閉会中の常任委員の所属変更について申し上げます。,null,null,null
59,東京都,平成23年_第２回,1,23,6,17,定例,平成23年_第２回定例会(第７号),議長（和田宗春君）,議長,議長,和田宗春,去る四月二十八日付をもって、小沢昌也君より、公営企業委員から総務委員へ常任委員の所属変更の申し出がありましたので、委員会条例第五条第三項ただし書きの規定により、議長において、同日付をもってこれを許可いたしました。,null,null,null
60,東京都,平成23年_第２回,1,23,6,17,定例,平成23年_第２回定例会(第７号),議長（和田宗春君）,議長,議長,和田宗春,━━━━━━━━━━,null,null,null
61,東京都,平成23年_第２回,1,23,6,17,定例,平成23年_第２回定例会(第７号),議長（和田宗春君）,議長,議長,和田宗春,次に、閉会中の常任委員の選任について申し上げます。,null,null,null
62,東京都,平成23年_第２回,1,23,6,17,定例,平成23年_第２回定例会(第７号),議長（和田宗春君）,議長,議長,和田宗春,委員会条例第五条第四項の規定により、去る四月二十八日付をもって、議長において、新たに当選されました小宮あんりさんを総務委員に指名いたしました。,null,null,null
63,東京都,平成23年_第２回,1,23,6,17,定例,平成23年_第２回定例会(第７号),議長（和田宗春君）,議長,議長,和田宗春,━━━━━━━━━━,null,null,null
64,東京都,平成23年_第２回,1,23,6,17,定例,平成23年_第２回定例会(第７号),議長（和田宗春君）,議長,議長,和田宗春,次に、閉会中の議会運営委員の辞任及び選任について申し上げます。,null,null,null
65,東京都,平成23年_第２回,1,23,6,17,定例,平成23年_第２回定例会(第７号),議長（和田宗春君）,議長,議長,和田宗春,去る四月二十八日付をもって、今村るか君より辞任願が提出されましたので、委員会条例第十一条第一項ただし書きの規定により、議長において、同日付をもってこれを許可いたしました。,null,null,null
66,東京都,平成23年_第２回,1,23,6,17,定例,平成23年_第２回定例会(第７号),議長（和田宗春君）,議長,議長,和田宗春,なお、委員の欠員を補充するため、委員会条例第五条第四項の規定により、議長において、同日付をもって大山とも子さんを指名いたしました。,null,null,null
67,東京都,平成23年_第２回,1,23,6,17,定例,平成23年_第２回定例会(第７号),議長（和田宗春君）,議長,議長,和田宗春,━━━━━━━━━━,null,null,null
68,東京都,平成23年_第２回,1,23,6,17,定例,平成23年_第２回定例会(第７号),議長（和田宗春君）,議長,議長,和田宗春,次に、閉会中の東京都中央卸売市場築地市場の移転・再整備に関する特別委員の欠員の補充について申し上げます。,null,null,null
69,東京都,平成23年_第２回,1,23,6,17,定例,平成23年_第２回定例会(第７号),議長（和田宗春君）,議長,議長,和田宗春,議員の退職に伴い、同委員に欠員が生じましたので、委員会条例第五条第四項の規定により、議長において、去る四月十八日付をもって佐藤由美さんを指名いたしました。,null,null,null
70,東京都,平成23年_第２回,1,23,6,17,定例,平成23年_第２回定例会(第７号),議長（和田宗春君）,議長,議長,和田宗春,━━━━━━━━━━,null,null,null
71,東京都,平成23年_第２回,1,23,6,17,定例,平成23年_第２回定例会(第７号),議長（和田宗春君）,議長,議長,和田宗春,会期についてお諮りいたします。,null,null,null
72,東京都,平成23年_第２回,1,23,6,17,定例,平成23年_第２回定例会(第７号),議長（和田宗春君）,議長,議長,和田宗春,今回の定例会の会期は、本日から七月一日までの十五日間といたしたいと思います。,null,null,null
73,東京都,平成23年_第２回,1,23,6,17,定例,平成23年_第２回定例会(第７号),議長（和田宗春君）,議長,議長,和田宗春,これにご異議ありませんか。,null,null,null
74,東京都,平成23年_第２回,1,23,6,17,定例,平成23年_第２回定例会(第７号),議長（和田宗春君）,議長,議長,和田宗春,〔「異議なし」と呼ぶ者あり〕,null,null,null
75,東京都,平成23年_第２回,1,23,6,17,定例,平成23年_第２回定例会(第７号),議長（和田宗春君）,議長,議長,和田宗春,ご異議なしと認めます。,null,null,null
76,東京都,平成23年_第２回,1,23,6,17,定例,平成23年_第２回定例会(第７号),議長（和田宗春君）,議長,議長,和田宗春,よって、会期は十五日間と決定いたしました。,null,null,null
77,東京都,平成23年_第２回,1,23,6,17,定例,平成23年_第２回定例会(第７号),議長（和田宗春君）,議長,議長,和田宗春,━━━━━━━━━━,null,null,null
78,東京都,平成23年_第２回,1,23,6,17,定例,平成23年_第２回定例会(第７号),議長（和田宗春君）,議長,議長,和田宗春,この際、知事より発言の申し出がありますので、これを許可します。,null,null,null
79,東京都,平成23年_第２回,1,23,6,17,定例,平成23年_第２回定例会(第７号),議長（和田宗春君）,議長,議長,和田宗春,知事石原慎太郎君。,null,null,null
80,東京都,平成23年_第２回,1,23,6,17,定例,平成23年_第２回定例会(第７号),議長（和田宗春君）,議長,議長,和田宗春,〔知事石原慎太郎君登壇〕,null,null,null
81,東京都,平成23年_第２回,1,23,6,17,定例,平成23年_第２回定例会(第７号),知事（石原慎太郎君）,知事,知事,石原慎太郎,平成二十三年第二回都議会定例会の開会に当たりまして、都政運営に対する所信の一端を申し述べ、都議会の皆様と都民の皆様のご理解、ご協力を得たいと思います。,null,null,null
82,東京都,平成23年_第２回,1,23,6,17,定例,平成23年_第２回定例会(第７号),知事（石原慎太郎君）,知事,知事,石原慎太郎,戦後、我々は、アメリカ依存の平和に安住しながら繁栄を謳歌し、かつてない物質的な豊かさと引きかえに、日本人としての価値の基軸を失ってまいりました。,null,null,null
83,東京都,平成23年_第２回,1,23,6,17,定例,平成23年_第２回定例会(第７号),知事（石原慎太郎君）,知事,知事,石原慎太郎,目先の欲望の成就のみを願いながら、いかなる負担をも責任をも忌避し、あまつさえ自分の肉親が亡くなっても弔いもせずに放置して、その年金を詐取するやからさえあらわれております。,null,null,null
84,東京都,平成23年_第２回,1,23,6,17,定例,平成23年_第２回定例会(第７号),知事（石原慎太郎君）,知事,知事,石原慎太郎,目を外に転じれば国際競争は厳しさを増しており、内向きになって困難な課題を先送りし続けることはとても許されません。,null,null,null
85,東京都,平成23年_第２回,1,23,6,17,定例,平成23年_第２回定例会(第７号),知事（石原慎太郎君）,知事,知事,石原慎太郎,少子高齢化という構造変化を冷静にとらえて、社会保障や税制を痛みに耐えても立て直しながら、世界と伍す戦略と戦術を構えることを求められております。,null,null,null
86,東京都,平成23年_第２回,1,23,6,17,定例,平成23年_第２回定例会(第７号),知事（石原慎太郎君）,知事,知事,石原慎太郎,にもかかわらず、肝心の国の政は、みずからの保身のために国民の顔色をうかがうばかりであります。,null,null,null
87,東京都,平成23年_第２回,1,23,6,17,定例,平成23年_第２回定例会(第７号),知事（石原慎太郎君）,知事,知事,石原慎太郎,もはや財政は実質的に破綻しており、国家としての命運はこの数年で決せられるところまできわまってきております。,null,null,null
88,東京都,平成23年_第２回,1,23,6,17,定例,平成23年_第２回定例会(第７号),知事（石原慎太郎君）,知事,知事,石原慎太郎,こうした状況のもとで、東日本大震災は発生いたしました。,null,null,null
89,東京都,平成23年_第２回,1,23,6,17,定例,平成23年_第２回定例会(第７号),知事（石原慎太郎君）,知事,知事,石原慎太郎,今回の巨大地震と大津波では、東北のまちはどこまでも続く瓦れきと化し、産業も大打撃を受けました。,null,null,null
90,東京都,平成23年_第２回,1,23,6,17,定例,平成23年_第２回定例会(第７号),知事（石原慎太郎君）,知事,知事,石原慎太郎,私も被災地を訪れ、みずからの目で確かめましたが、まさに地獄絵、言葉もありません。,null,null,null
91,東京都,平成23年_第２回,1,23,6,17,定例,平成23年_第２回定例会(第７号),知事（石原慎太郎君）,知事,知事,石原慎太郎,亡くなられた方々のご冥福を心からお祈りするとともに、被災された方々、そして原発事故によって避難を余儀なくされている方々に心からお見舞いを申し上げます。,null,null,null
92,東京都,平成23年_第２回,1,23,6,17,定例,平成23年_第２回定例会(第７号),知事（石原慎太郎君）,知事,知事,石原慎太郎,原発事故によって日本の安全神話は消えることになりました。,null,null,null
93,東京都,平成23年_第２回,1,23,6,17,定例,平成23年_第２回定例会(第７号),知事（石原慎太郎君）,知事,知事,石原慎太郎,国際社会からも危機管理能力が問われ、信頼を失っております。,null,null,null
94,東京都,平成23年_第２回,1,23,6,17,定例,平成23年_第２回定例会(第７号),知事（石原慎太郎君）,知事,知事,石原慎太郎,このままでは日本自体が見限られ、ジャパンパッシングが加速し、経済は疲弊し、人材、企業、技術は流出していきかねません。,null,null,null
95,東京都,平成23年_第２回,1,23,6,17,定例,平成23年_第２回定例会(第７号),知事（石原慎太郎君）,知事,知事,石原慎太郎,国難のもとでも、なお、国は誤った政治主導で官僚組織を全く使いこなせず、対応が後手後手に回っております。,null,null,null
96,東京都,平成23年_第２回,1,23,6,17,定例,平成23年_第２回定例会(第７号),知事（石原慎太郎君）,知事,知事,石原慎太郎,未曾有の事態を辛うじて救っているのは、名もなき現場の日本人たちなのであります。,null,null,null
97,東京都,平成23年_第２回,1,23,6,17,定例,平成23年_第２回定例会(第７号),知事（石原慎太郎君）,知事,知事,石原慎太郎,歯を食いしばりながらも、ささやかな援助にすら涙して感謝する被災者に、医療、福祉スタッフやボランティアが寄り添っております。,null,null,null
